<?xml version="1.0" encoding="UTF-8"?>
<scientific_paper xmlns:jxb="http://java.sun.com/xml/ns/jaxb"
 xmlns:xjc="http://java.sun.com/xml/ns/jaxb/xjc"
 xmlns:pred="https://github.com/AnaMijailovic/XML-Tim19/predicate/"
 xmlns:rdfa="http://www.w3.org/ns/rdfa#"
 xmlns="https://github.com/AnaMijailovic/XML-Tim19"
 xmlns:xsi="http://www.w3.org/2001/XMLSchema-instance"
 xmlns:xs="http://www.w3.org/2001/XMLSchema#"
 xsi:schemaLocation="https://github.com/AnaMijailovic/XML-Tim19 file:/C:/Users/anaam/Desktop/XML%20Project/XML-Tim19/scientific_papers/scientific_papers/src/main/resources/xsd/scientific_paper.xsd" id="ID001" status="ACCEPTED"
  >
    <head rdfa:vocab="https://github.com/AnaMijailovic/XML-Tim19/predicate/"
  		  rdfa:about="https://github.com/AnaMijailovic/XML-Tim19/scientific_papers/paper1"
  		  >  
        <recieved_date rdfa:property="pred:recieved" rdfa:datatype="xs:date">2011-05-04</recieved_date>
        <revised_date rdfa:property="pred:revised" rdfa:datatype="xs:date">2011-06-04</revised_date>
        <accepted_date rdfa:property="pred:accepted" rdfa:datatype="xs:date">2011-07-04</accepted_date>
        <title lang="lang1" rdfa:property="pred:titled" rdfa:datatype="xs:string">XML Databases</title>
        <title lang="lang3" rdfa:property="pred:titled" rdfa:datatype="xs:string">XML baze podataka</title>   
        <author rdfa:about="https://github.com/AnaMijailovic/XML-Tim19/authors/author2"
        		rdfa:rel="pred:isTheAuthorOf" 
        		rdfa:rev="pred:isWrittenBy"
        		rdfa:href="https://github.com/AnaMijailovic/XML-Tim19/scientific_papers/paper1"
        		>
            <first_name rdfa:property="pred:firstName" rdfa:datatype="xs:string" >Johanna</first_name>
            <last_name rdfa:property="pred:lastName" rdfa:datatype="xs:string">Smith</last_name>
            <affiliation rdfa:about="https://github.com/AnaMijailovic/XML-Tim19/affiliation/affiliation1"
            		     rdfa:rel="pred:hasAMember" 
            		     rdfa:rev="pred:isAMemberOf" 
            		     rdfa:href="https://github.com/AnaMijailovic/XML-Tim19/authors/author2">
                <name rdfa:property="pred:affiliationNamed" rdfa:datatype="xs:string">MIT</name>
                <city>city0</city>
                <country>country0</country>
            </affiliation>
        </author>
        <author rdfa:about="https://github.com/AnaMijailovic/XML-Tim19/authors/author3"
        		rdfa:rel="pred:isTheAuthorOf" 
        		rdfa:rev="pred:isWrittenBy"
        		rdfa:href="https://github.com/AnaMijailovic/XML-Tim19/scientific_papers/paper1">
            <first_name rdfa:property="pred:firstName" rdfa:datatype="xs:string" >Mariana</first_name>
            <last_name rdfa:property="pred:lastName" rdfa:datatype="xs:string">Peterson</last_name>
            <affiliation rdfa:about="https://github.com/AnaMijailovic/XML-Tim19/affiliation/affiliation1"
            		     rdfa:rel="pred:hasAMember" 
            		     rdfa:rev="pred:isAMemberOf" 
            		     rdfa:href="https://github.com/AnaMijailovic/XML-Tim19/authors/author3">
                <name rdfa:property="pred:affiliationNamed" rdfa:datatype="xs:string">MIT</name>
                <city>city1</city> 
                <country>country1</country>
            </affiliation>
        </author>
        <keyword rdfa:property="pred:keyword" rdfa:datatype="xs:string">xml</keyword>
        <keyword rdfa:property="pred:keyword" rdfa:datatype="xs:string"></keyword>
    </head>
    <body>
        <abstract id="ID003">
            <paragraph id="ID005">
            </paragraph>
            <paragraph id="ID007">
            </paragraph>
        </abstract>
        <chapter id="ID009" level="3">
            <heading>heading0</heading>
            <paragraph id="ID011">
                <table id="ID013">
                    <name>name2</name>
                    <description>description0</description>
                    <tr>
                        <th>th0</th>
                        <th>th1</th>
                    </tr>
                    <tr>
                        <td>td0</td>
                        <td>td1</td>
                    </tr>
                </table>
                <table id="ID015">
                    <name>name3</name>
                    <description>description1</description>
                    <tr>
                        <td>td2</td>
                        <td>td3</td>
                    </tr>
                    <tr>
                        <th>th2</th>
                        <th>th3</th>
                    </tr>
                </table>
            </paragraph>
            <paragraph id="ID017">
                <image id="ID019" src="src1">
                    <name>name4</name>
                    <description>description2</description>
                </image>
                <image id="ID021" src="src3">
                    <name>name5</name>
                    <description>description3</description>
                </image>
            </paragraph>
            <chapter>
                <heading>heading1</heading>
                <paragraph id="IDgr025">
                    <image id="IDrg027" src="srcg5">
                        <name>name6</name>
                        <description>description4</description>
                    </image>
                </paragraph>
                <chapter>
                <heading>heading1</heading>
                <paragraph id="IDrtgr025">
                    <image id="IDrrtgg027" src="srcg5">
                        <name>name6</name>
                        <description>description4</description>
                    </image>
                </paragraph>
                <chapter>
                <heading>heading1</heading>
                <paragraph id="IDgrfgh025">
                    <image id="IDrgfjny027" src="srcg5">
                        <name>name6</name>
                        <description>description4</description>
                    </image>
                </paragraph>
                 <chapter>
                <heading>heading1</heading>
                <paragraph id="IDgrdffgh025">
                    <image id="IDrgdffjny027" src="srcg5">
                        <name>name6</name>
                        <description>description4</description>
                    </image>
                </paragraph>
                 <chapter>
                <heading>heading1</heading>
                <paragraph id="IgDgrfgh025">
                    <image id="IDrgfjngy027" src="srcg5">
                        <name>name6</name>
                        <description>description4</description>
                    </image>
                </paragraph>
            </chapter>
            </chapter>
            </chapter>
            </chapter>
            </chapter>
        </chapter>
        <chapter id="ID023" level="3">
            <heading>heading1</heading>
            <paragraph id="ID025">
                <image id="ID027" src="src5">
                    <name>name6</name>
                    <description>description4</description>
                </image>
            </paragraph>
            <paragraph id="ID029">
                <table id="ID031">
                    <name>name7</name>
                    <description>description5</description>
                    <tr>
                        <td>td4</td>
                        <td>td5</td>
                    </tr>
                    <tr>
                        <th>th4</th>
                        <th>th5</th>
                    </tr>
                </table>
            </paragraph>
        </chapter>
        <references id="ID033">
            <reference id="ID035">
                <title>title2</title>
                <reference_author>
                    <first_name>first_name2</first_name>
                    <last_name>last_name2</last_name>
                </reference_author>
                <reference_author>
                    <first_name>first_name3</first_name>
                    <last_name>last_name3</last_name>
                </reference_author>
                <publisher>publisher0</publisher>
                <year_of_publication>2006</year_of_publication>
                <pages>pages0</pages>
            </reference>
            <reference id="ID037">
                <title>title3</title>
                <reference_author>
                    <first_name>first_name4</first_name>
                    <last_name>last_name4</last_name>
                </reference_author>
                <reference_author>
                    <first_name>first_name5</first_name>
                    <last_name>last_name5</last_name>
                </reference_author>
                <publisher>publisher1</publisher>
                <year_of_publication>2006</year_of_publication>
                <pages>pages1</pages>
            </reference>
        </references>
    </body>
</scientific_paper>
