<?xml version="1.0" encoding="UTF-8"?>
<xm:scientific_paper xmlns:jxb="http://java.sun.com/xml/ns/jaxb"
 xmlns:xjc="http://java.sun.com/xml/ns/jaxb/xjc"
 xmlns:pred="https://github.com/AnaMijailovic/XML-Tim19/predicate/"
 xmlns:rdfa="http://www.w3.org/ns/rdfa#"
 xmlns:xm="https://github.com/AnaMijailovic/XML-Tim19"
 xmlns:xsi="http://www.w3.org/2001/XMLSchema-instance"
 xsi:schemaLocation="https://github.com/AnaMijailovic/XML-Tim19 file:/C:/Users/anaam/Desktop/XML%20Project/XML-Tim19/scientific_papers/scientific_papers/src/main/resources/xsd/scientific_paper.xsd" id="ID000">
    <xm:head>
        <xm:recieved_date>2006-05-04</xm:recieved_date>
        <xm:revised_date>2006-05-04</xm:revised_date>
        <xm:accepted_date>2006-05-04</xm:accepted_date>
        <xm:title>title0</xm:title>
        <xm:title>title1</xm:title>
        <xm:author>
            <xm:first_name>first_name0</xm:first_name>
            <xm:last_name>last_name0</xm:last_name>
            <xm:affiliation>
                <xm:name>name0</xm:name>
                <xm:city>city0</xm:city>
                <xm:country>country0</xm:country>
            </xm:affiliation>
        </xm:author>
        <xm:author>
            <xm:first_name>first_name1</xm:first_name>
            <xm:last_name>last_name1</xm:last_name>
            <xm:affiliation>
                <xm:name>name1</xm:name>
                <xm:city>city1</xm:city>
                <xm:country>country1</xm:country>
            </xm:affiliation>
        </xm:author>
        <xm:keyword>keyword0</xm:keyword>
        <xm:keyword>keyword1</xm:keyword>
    </xm:head>
    <xm:body>
        <xm:abstract>
            <xm:paragraph>
            </xm:paragraph>
            <xm:paragraph>
            </xm:paragraph>
        </xm:abstract>
        <xm:chapter>
            <xm:heading>heading0</xm:heading>
            <xm:paragraph>
                <xm:table>
                    <xm:name>name2</xm:name>
                    <xm:description>description0</xm:description>
                    <xm:tr>
                        <xm:th>th0</xm:th>
                        <xm:th>th1</xm:th>
                    </xm:tr>
                    <xm:tr>
                        <xm:td>td0</xm:td>
                        <xm:td>td1</xm:td>
                    </xm:tr>
                </xm:table>
            </xm:paragraph>
            <xm:paragraph>
                <xm:image src="src0">
                    <xm:name>name3</xm:name>
                    <xm:description>description1</xm:description>
                </xm:image>
            </xm:paragraph>
        </xm:chapter>
        <xm:chapter>
            <xm:heading>heading1</xm:heading>
            <xm:paragraph>
                <xm:table>
                    <xm:name>name4</xm:name>
                    <xm:description>description2</xm:description>
                    <xm:tr>
                        <xm:th>th2</xm:th>
                        <xm:th>th3</xm:th>
                    </xm:tr>
                    <xm:tr>
                        <xm:td>td2</xm:td>
                        <xm:td>td3</xm:td>
                    </xm:tr>
                </xm:table>
            </xm:paragraph>
            <xm:paragraph>
                <xm:table>
                    <xm:name>name5</xm:name>
                    <xm:description>description3</xm:description>
                    <xm:tr>
                        <xm:td>td4</xm:td>
                        <xm:td>td5</xm:td>
                    </xm:tr>
                    <xm:tr>
                        <xm:th>th4</xm:th>
                        <xm:th>th5</xm:th>
                    </xm:tr>
                </xm:table>
            </xm:paragraph>
        </xm:chapter>
        <xm:references>
            <xm:reference>
                <xm:title>title2</xm:title>
                <xm:reference_author>
                    <xm:first_name>first_name2</xm:first_name>
                    <xm:last_name>last_name2</xm:last_name>
                </xm:reference_author>
                <xm:reference_author>
                    <xm:first_name>first_name3</xm:first_name>
                    <xm:last_name>last_name3</xm:last_name>
                </xm:reference_author>
                <xm:publisher>publisher0</xm:publisher>
                <xm:year_of_publication>2006</xm:year_of_publication>
                <xm:pages>pages0</xm:pages>
            </xm:reference>
            <xm:reference>
                <xm:title>title3</xm:title>
                <xm:reference_author>
                    <xm:first_name>first_name4</xm:first_name>
                    <xm:last_name>last_name4</xm:last_name>
                </xm:reference_author>
                <xm:reference_author>
                    <xm:first_name>first_name5</xm:first_name>
                    <xm:last_name>last_name5</xm:last_name>
                </xm:reference_author>
                <xm:publisher>publisher1</xm:publisher>
                <xm:year_of_publication>2006</xm:year_of_publication>
                <xm:pages>pages1</xm:pages>
            </xm:reference>
        </xm:references>
    </xm:body>
</xm:scientific_paper>
